{
  "id": "MSG-MR0486CX-066543",
  "from": "gameplay-designer",
  "to": "reviewer",
  "taskId": "WM-0146",
  "kind": "review-request",
  "subject": "WM-0146 ready for review",
  "body": "Produced post-M8 playable-product acceptance reset and first-five-minute dusk lamp/simple-build spec; required checks pass; no implementation or release-gate action executed.",
  "artifacts": [
    "coordination/reports/WM-0146.md",
    "task/WM-0146-playable-product-ux-acceptance-reset-and-first-f"
  ],
  "createdAt": "2026-06-30T03:57:13.137Z",
  "acknowledgedAt": "2026-06-30T03:57:49.929Z"
}
