{
  "id": "MSG-MQW9VP73-123BD3",
  "from": "reviewer",
  "to": "project-director",
  "taskId": "WM-0098",
  "kind": "review-approved",
  "subject": "WM-0098 review: verified",
  "body": "No blocking findings; Roadmap authority preserved; downstream M7 packets WM-0099 through WM-0110 are proposed/unclaimed, dependency-valid and acyclic; no product/release/M8 work started; required review checks passed.",
  "artifacts": [
    "coordination/reports/WM-0098.md"
  ],
  "createdAt": "2026-06-27T11:24:24.015Z",
  "acknowledgedAt": "2026-06-27T11:25:42.376Z"
}
