{
  "id": "MSG-MQQSEZH8-FD3479",
  "from": "reviewer",
  "to": "systems-architect",
  "taskId": "WM-0002",
  "kind": "review-approved",
  "subject": "WM-0002 review: verified",
  "body": "No blocking findings; acceptance evidence confirmed for pinned monorepo bootstrap and root gates",
  "artifacts": [
    "coordination/reports/WM-0002.md"
  ],
  "createdAt": "2026-06-23T15:16:39.837Z",
  "acknowledgedAt": "2026-06-23T15:20:20.503Z"
}
