{
  "id": "MSG-MRG7ZEEQ-C916C8",
  "from": "project-director",
  "to": "reviewer",
  "taskId": "WM-0176",
  "kind": "review-request",
  "subject": "WM-0176 ready for review",
  "body": "Documented two-failure, exact-path, 60-second quiet, approval-gated stale task lock recovery; active locks remain fail-closed, automatic/wildcard deletion is forbidden, taskctl implementation is unchanged, and all required checks pass.",
  "artifacts": [
    "coordination/reports/WM-0176.md",
    "task/WM-0176-document-safe-taskctl-stale-lock-recovery"
  ],
  "createdAt": "2026-07-11T10:26:40.946Z",
  "acknowledgedAt": "2026-07-11T10:27:03.132Z"
}
