{
  "id": "MSG-MQYNMWQQ-A656E7",
  "from": "reviewer",
  "to": "client-engineer",
  "taskId": "WM-0143",
  "kind": "review-approved",
  "subject": "WM-0143 review: verified",
  "body": "No blocking findings; compact 390x720 and zh-CN large UI scale start-surface assertions pass; no E2E thresholds or forbidden paths changed.",
  "artifacts": [
    "coordination/reports/WM-0143.md"
  ],
  "createdAt": "2026-06-29T03:25:00.866Z",
  "acknowledgedAt": "2026-06-29T03:26:05.233Z"
}
