{
  "id": "MSG-MQW2CKIE-E5BE28",
  "from": "qa-performance",
  "to": "reviewer",
  "taskId": "WM-0095",
  "kind": "review-request",
  "subject": "WM-0095 ready for review",
  "body": "Addressed changes_requested: consolidation now fails unless benchmark baselinePath is packages/benchmarks/baseline.json, artifactPath is coordination/artifacts/WM-0095/benchmarks/benchmark-results.json, and every comparison keeps warn/fail thresholds exactly 10/20. Regenerated WM-0095 consolidation artifact and SHA-256 sidecar; consolidation, taskctl validate, git diff --check and pnpm quality pass.",
  "artifacts": [
    "coordination/reports/WM-0095.md",
    "task/WM-0095-m6-long-run-benchmark-consolidation"
  ],
  "createdAt": "2026-06-27T07:53:34.166Z",
  "acknowledgedAt": "2026-06-27T07:55:41.535Z"
}
